[
  {
    "id": "chara_001",
    "名前": "アルベルト",
    "性別": "男",
    "年齢": 22,
    "職業": "戦士",
    "体力": 80,
    "技量": 55,
    "知力": 30,
    "敏捷": 60,
    "魅力": 45,
    "名声": 0,
    "善悪値": 10,
    "資産": 100,
    "現在の状態": "休息中"
  },
  {
    "id": "chara_002",
    "名前": "リーナ",
    "性別": "女",
    "年齢": 19,
    "職業": "魔術師",
    "体力": 30,
    "技量": 50,
    "知力": 85,
    "敏捷": 55,
    "魅力": 70,
    "名声": 0,
    "善悪値": 20,
    "資産": 80,
    "現在の状態": "休息中"
  },
  {
    "id": "chara_003",
    "名前": "ガロン",
    "性別": "男",
    "年齢": 35,
    "職業": "商人",
    "体力": 40,
    "技量": 45,
    "知力": 60,
    "敏捷": 35,
    "魅力": 80,
    "名声": 30,
    "善悪値": -15,
    "資産": 500,
    "現在の状態": "休息中"
  },
  {
    "id": "chara_004",
    "名前": "シェラ",
    "性別": "女",
    "年齢": 27,
    "職業": "盗賊",
    "体力": 55,
    "技量": 90,
    "知力": 50,
    "敏捷": 95,
    "魅力": 40,
    "名声": 5,
    "善悪値": -40,
    "資産": 200,
    "現在の状態": "クエスト中"
  }
]
